<?xml version="1.0" encoding="UTF-8"?>
<MAP:Mappings xmlns:MAP="http://www.blow.org/Mapping" xmlns:xsi="http://www.w3.org/2001/XMLSchema-instance" xsi:schemaLocation="http://www.blow.org/Mapping ../../../../../BlowORM/src/com/sales/xmls/Mapping.xsd ">
  <MAP:Mapping>
    <MAP:Class>com.sales.pojo.Prodcty</MAP:Class>
    <MAP:RDBSchema>product</MAP:RDBSchema>
    <MAP:Map>
    	<MAP:Property name="id" type="int" colName="id" primary-key="true" length="5" generated="true" seq="product_seq"/>
    	<MAP:Property name="name" type="String" colName="name" length="50"/>
    	<MAP:Property name="catId" type="long" colName="cat_id"/> 	
    	<MAP:one-2-one name="details" ref-class="com.sales.pojo.ProductDetails" foreign-key="PROD_ID" foreign-key-ref="true"/>
    	<MAP:one-2-one name="stock" ref-class="com.sales.pojo.Stock" foreign-key="PROD_ID" foreign-key-ref="true"/>
    	<MAP:one-2-one name="epd" ref-class="com.sales.pojo.ElectronicProductDetails" foreign-key="PROD_ID" foreign-key-ref="true"/>
    	<MAP:one-2-many ref-class="com.sales.pojo.Stock" name="stocks" foreign-key="PROD_ID" collectionType="list" foreign-key-ref="true"/>
    </MAP:Map>
  </MAP:Mapping>
  
  <MAP:Mapping>
  	<MAP:Class>com.sales.pojo.ProductDetails</MAP:Class>
  	<MAP:RDBSchema>product_details</MAP:RDBSchema>
  	<MAP:Map>
     	<MAP:Property name="id" type="int" colName="id" primary-key="true" generated="true" seq="PD_SEQ"/>
  		<MAP:Property name="prodId" type="int" colName="PROD_ID"/>
  		<MAP:Property name="brand" type="String" colName="BRAND"/>
  		<MAP:Property name="color" type="String" colName="COLOR"/>
  		<MAP:Property name="productSize" type="String" colName="PROD_SIZE"/>
  		<MAP:Property name="price" type="int" colName="PRICE"/>
  		<MAP:Property name="material" type="String" colName="MATERIAL"/>
  		<MAP:one-2-one name="product" ref-class="com.sales.pojo.Prodcty" foreign-key="PROD_ID"/>
  	</MAP:Map>
  </MAP:Mapping>
  <MAP:Mapping>
  	<MAP:Class>com.sales.pojo.ElectronicProductDetails</MAP:Class>
  	<MAP:RDBSchema>ELECTRONIC_PRODUCT_DETAILS</MAP:RDBSchema>
  	<MAP:Map>
     	<MAP:Property name="id" type="int" colName="id" primary-key="true" generated="true" seq="EPD_SEQ"/>
  		<MAP:Property name="description" type="String" colName="ELE_DESCRIPTION"/>
  		<MAP:Property name="techDetails" type="String" colName="TECH_DETAILS"/>
  		<MAP:Property name="prodId" type="int" colName="PROD_ID"/>
  		<MAP:Property name="brand" type="String" colName="BRAND"/>
  		<MAP:Property name="color" type="String" colName="COLOR"/>
  		<MAP:Property name="price" type="int" colName="PRICE"/>
  		<MAP:Property name="material" type="String" colName="MATERIAL"/>
  		<MAP:one-2-one name="product" ref-class="com.sales.pojo.Prodcty" foreign-key="ID"/>
  	</MAP:Map>
  </MAP:Mapping>
  
  <MAP:Mapping>
  	<MAP:Class>com.sales.pojos.ElectronicProductDetails</MAP:Class>
  	<MAP:RDBSchema>ELECTRONIC_PRODUCT_DETAILS</MAP:RDBSchema>
  	<MAP:Map>
     	<MAP:Property name="id" type="int" colName="id" primary-key="true" generated="true" seq="EPD_SEQ"/>
  		<MAP:Property name="description" type="String" colName="ELE_DESCRIPTION"/>
  		<MAP:Property name="techDetails" type="String" colName="TECH_DETAILS"/>
  		<MAP:Property name="prodId" type="int" colName="PROD_ID"/>
  		<MAP:Property name="brand" type="String" colName="BRAND"/>
  		<MAP:Property name="color" type="String" colName="COLOR"/>
  		<MAP:Property name="price" type="int" colName="PRICE"/>
  		<MAP:Property name="material" type="String" colName="MATERIAL"/>
  		<MAP:one-2-one name="product" ref-class="com.sales.pojo.Prodcty" foreign-key="ID"/>
  	</MAP:Map>
  </MAP:Mapping>
</MAP:Mappings>
